{
    "artifact_type": "insights",
    "version": "1.0",
    "insights": [
      {
        "id": "ins_0001",
        "title": "Core conditions for uniform convergence",
        "takeaway": "Uniform convergence typically requires controlling model capacity (e.g., via VC-dimension or Rademacher complexity) and sample size; this underpins generalization guarantees."
      }
    ],
    "provenance": {
      "N3": { "note_id": "note_xyz789", "similarity": 0.75 }
    },
    "metrics": {
      "tokens_in": 880,
      "tokens_out": 260,
      "latency_ms": 690
    }
  }
  